<?xml version="1.0" encoding="UTF-8"?>
<!--
  -  Copyright 2001-2008 Geert Bevin <gbevin[remove] at uwyn dot com>
  -  Licensed under the Apache License, Version 2.0 (the "License")
  -  $Id: multiple.xml 3918 2008-04-14 17:35:35Z gbevin $
  -->

<!DOCTYPE element SYSTEM "/dtd/element.dtd">

<element implementation="com.uwyn.rife.engine.testelements.submission.Multiple">
	<submission name="login">
		<param name="login"/>
		<param name="password"/>
		<param name="language"/>
	</submission>
	<submission name="register">
		<param name="login"/>
		<param name="password"/>
		<param name="firstname"/>
		<param name="lastname"/>
	</submission>
</element>

