<?xml version="1.0" encoding="UTF-8"?>
<!--
  -  Copyright 2001-2008 Geert Bevin <gbevin[remove] at uwyn dot com>
  -  Licensed under the Apache License, Version 2.0 (the "License")
  -  $Id: purging_database_authenticated_encrypted.xml 3918 2008-04-14 17:35:35Z gbevin $
  -->

<!DOCTYPE element SYSTEM "/dtd/element.dtd">

<element extends="rife/authenticated/database.xml">
	<property name="datasource"><datasource><config param="purgingunittestsdatasource"/></datasource></property>

	<property name="credentialsmanager_id">encrypted</property>
	<property name="template_name">authentication_database</property>
	<property name="password_encryption">SHA</property>
	<property name="session_duration">2000</property>
	<property name="session_purge_frequency">1</property>
	<property name="session_purge_scale">1</property>

	<submission name="credentials">
		<param name="login"/>
		<param name="password"/>
	</submission>

	<childtrigger name="authid"/>
</element>

