<?xml version="1.0" encoding="UTF-8"?>
<!--
  -  Copyright 2001-2008 Geert Bevin <gbevin[remove] at uwyn dot com>
  -  Licensed under the Apache License, Version 2.0 (the "License")
  -  $Id: typed_injection.xml 3918 2008-04-14 17:35:35Z gbevin $
  -->

<!DOCTYPE element SYSTEM "/dtd/element.dtd">

<element implementation="com.uwyn.rife.engine.testelements.submission.TypedInjection">
	<submission name="typed">
		<param name="paramstring1"/>
		<param name="paramstring2"/>
		<param name="paramint1"/>
		<param name="paramint2">
			<default>378</default>
		</param>
		<param name="paramlong1"/>
		<param name="paramlong2"/>
		<param name="paramdouble1"/>
		<param name="paramdouble2"/>
		<param name="paramfloat1"/>
		<param name="paramfloat2"/>
		<param name="parammultiple"/>
	</submission>
</element>

