<?xml version="1.0" encoding="UTF-8"?>
<!--
  -  Copyright 2001-2008 Geert Bevin <gbevin[remove] at uwyn dot com>
  -  Licensed under the Apache License, Version 2.0 (the "License")
  -  $Id: defaults.xml 3918 2008-04-14 17:35:35Z gbevin $
  -->

<!DOCTYPE element SYSTEM "/dtd/element.dtd">

<element implementation="com.uwyn.rife.engine.testelements.cookies.Defaults">
	<incookie name="cookie1">
		<default>the first cookie</default>
	</incookie>
	<incookie name="cookie2"/>
	<incookie name="cookie3">
		<default><config param="ENGINE_ELEMENT_CONFIG_VALUE"/></default>
	</incookie>
	<outcookie name="cookie3"/>
	<outcookie name="cookie4">
		<default><config param="ENGINE_ELEMENT_CONFIG_VALUE"/></default>
	</outcookie>
	<outcookie name="cookie5">
		<default>the fifth cookie</default>
	</outcookie>
</element>
