<?xml version="1.0" encoding="UTF-8"?>
<!--
  -  Copyright 2001-2008 Geert Bevin <gbevin[remove] at uwyn dot com>
  -  Licensed under the Apache License, Version 2.0 (the "License")
  -  $Id: generatedform_source.xml 3918 2008-04-14 17:35:35Z gbevin $
  -->

<!DOCTYPE element SYSTEM "/dtd/element.dtd">

<element implementation="com.uwyn.rife.engine.testelements.exits.GeneratedformSource">
	<input name="setoutputs"><default>1</default></input>
	<output name="output1"/>
	<output name="output2"/>
	<output name="output3"/>

	<exit name="exit1"/>
	<exit name="exit2"/>
</element>

