<?xml version="1.0" encoding="UTF-8"?>
<!--
  -  Copyright 2001-2008 Geert Bevin <gbevin[remove] at uwyn dot com>
  -  Licensed under the Apache License, Version 2.0 (the "License")
  -  $Id: source.xml 3918 2008-04-14 17:35:35Z gbevin $
  -->

<!DOCTYPE element SYSTEM "/dtd/element.dtd">

<element implementation="com.uwyn.rife.engine.testelements.globals.Source">
	<input name="switch"/>
	<input name="reflected"/>
	<input name="reflected_overridden"/>
	<input name="not_reflected"/>
	
	<exit name="exit1"/>
	<exit name="exit2"/>

	<output name="reflected"/>
	<output name="reflected_overridden"/>
</element>

